{
  "topic": "Tabular Data Foundation Model with Causal Discovery and Zero-Shot Inference — Training a foundation model from scratch on synthetic tabular data that simultaneously performs prediction and identifies causal relationships between columns without any fine-tuning on target datasets",
  "topic_slug": "tabular-causal-foundation-zero-shot",
  "method_description": "方法是一个从零开始训练（非基于现有预训练模型骨干）的表格数据基础模型，具备两个核心能力：（1）零样本/少样本表格预测（in-context learning，直接在上下文中给出训练样本和测试样本，无需梯度更新）；（2）因果发现——在推理时识别给定表格各列之间的因果有向图（DAG），无需额外训练或微调。关键设计问题包括：A）合成训练数据生成策略：应研究基于结构因果模型（SCM）的合成数据生成，生成带有已知真实因果图的多样化表格数据集，用于同时监督预测任务和因果发现任务；B）模型架构：应研究适合表格数据的Transformer或类似结构（如TabPFN风格的prior-fitted network，或基于行/列注意力的双流Transformer），需要同时输出预测分布和列间因果图的后验概率；C）训练目标：应包含预测损失（交叉熵/回归损失）和因果图恢复损失（如结构汉明距离、SHD，或基于DAG约束的损失）；D）零样本泛化：模型应在任意新表格数据集上直接推理，不依赖数据集特定的超参数调整。",
  "language": "中文、英文",
  "year_range": "2022-2026",
  "sources": ["arXiv", "Semantic Scholar", "Google Scholar"],
  "target_venue": "AAAI",
  "compute_budget_gpu_hours": 240,
  "deadline": "unknown",
  "success_metric": "Causal discovery SHD <= 3.0 and Prediction AUROC >= 0.85 across two tabular benchmarks with mean+-std over 3 seeds",
  "min_delta": 0.005,
  "patience": 2,
  "enable_revision_loop": true,
  "revision_patience": 3,
  "revision_convergence_threshold": 0.1,
  "revision_score_threshold": 95,
  "revision_patience_max_rounds": 20,
  "baseline_repositories": [
    "https://github.com/PriorLabs/TabPFN",
    "https://github.com/microsoft/reliableAI",
    "https://github.com/huawei-noah/trustworthyAI",
    "https://github.com/cmu-phil/causal-learn"
  ],
  "commands": {
    "setup": [
      "C:/Users/39009/anaconda3/envs/icet/python.exe -m pip install --disable-pip-version-check -q numpy pandas scikit-learn torch networkx causal-learn pgmpy cdt"
    ],
    "experiment": [
      "C:/Users/39009/anaconda3/envs/icet/python.exe {{RUN_DIR_REL}}/experiments/train_causal_tabfm.py --run-dir {{RUN_DIR_REL}} --seeds 11 22 33"
    ],
    "evalMetric": "C:/Users/39009/anaconda3/envs/icet/python.exe {{RUN_DIR_REL}}/experiments/print_best_metrics.py --summary {{RUN_DIR_REL}}/results/summary.json"
  }
}
